{
  "apiVersion": "scintilla.run/lambda/v1",
  "name": "binary-executable-example",
  "runtime": "binary",
  "protocol": "stdio-json-v1",
  "handler": "main",
  "artifact": {
    "kind": "executable",
    "command": "/opt/scintilla/bin/lambda",
    "sha256": "2222222222222222222222222222222222222222222222222222222222222222",
    "os": "linux",
    "architecture": "riscv64"
  }
}
